{
  "schema_version": "1.0.0",
  "authority": "ChangeBridge Part 1 Stage 4",
  "canonicalization_profile": "changebridge-canonical-json/1.0.0",
  "compatibility_policy": {
    "add_optional_field": "BACKWARD_COMPATIBLE_WITH_NEW_MINOR",
    "add_required_field": "BREAKING_NEW_MAJOR",
    "enum_expansion": "READER_DEPENDENT_NEW_MINOR",
    "enum_contraction": "BREAKING_NEW_MAJOR",
    "numeric_or_type_change": "BREAKING_NEW_MAJOR",
    "rename_or_remove": "BREAKING_NEW_MAJOR",
    "semantic_reinterpretation": "BREAKING_NEW_CONTRACT_ID",
    "reader_writer_negotiation": "writer emits exact contract ID/version/digest; reader accepts only a registered compatible version",
    "migration": "explicit deterministic converter with source and target digests",
    "deprecation": "catalog replacement ID plus removal stage; historical evidence remains immutable",
    "unknown_version": "REJECT_AND_QUARANTINE",
    "unknown_field": "REJECT"
  },
  "required_logical_records": [
    "active_generation",
    "applied_transaction",
    "cdc_apply_manifest",
    "cdc_envelope",
    "evidence_bundle",
    "frontier_checkpoint",
    "gate_result",
    "migration_generation",
    "orders_source_contract",
    "proof_manifest",
    "publication_event",
    "reconciliation_run",
    "rollback_event",
    "schema_contract",
    "source_workload",
    "stage_receipt",
    "target_record_metadata"
  ],
  "contracts": [
    {
      "id": "cdc_envelope",
      "title": "Canonical CDC envelope",
      "version": "1.0.0",
      "schema_uri": "urn:changebridge:contract:cdc-envelope:1.0.0",
      "authority_path": "contracts/cdc-envelope-v1.schema.json",
      "schema_pointer": "#",
      "owner": "normalizer",
      "producers": ["snapshot-reader", "cdc-capture"],
      "consumers": ["cdc-normalizer", "target-apply-adapter", "evidence-assembler"],
      "compatibility_class": "STRICT_MAJOR_ADDITIVE_MINOR",
      "required_fields": ["contract_version", "source_position", "transaction_id", "event_sequence", "operation", "primary_key", "source_contract_id", "source_contract_digest", "event_id", "payload_digest", "run_id", "generation_id"],
      "optional_fields": ["quarantine_reason"],
      "conditional_fields": ["before", "after"],
      "unknown_field_policy": "REJECT",
      "canonicalization_profile": "changebridge-canonical-json/1.0.0",
      "identity_profile": "event_id+payload_digest",
      "requirement_ids": ["CB-ORDER-001", "CB-ORDER-003", "CB-SCHEMA-001"],
      "adr_ids": ["ADR-003", "ADR-004", "ADR-005", "ADR-007", "ADR-008"],
      "component_ids": ["manifest_normalizer"],
      "invariant_ids": ["order", "conflict_detection", "delete_correctness", "schema_safety", "replay_determinism"],
      "claim_ids": [],
      "lifecycle": "ACTIVE",
      "replacement_id": null,
      "deprecation_stage": null,
      "local_validator": "changebridge.contracts.validate_cdc_event",
      "future_managed_proof_owner": "part3-managed-proof"
    },
    {
      "id": "source_workload",
      "title": "Deterministic source workload",
      "version": "1.0.0",
      "schema_uri": "urn:changebridge:contract:source-workload:1.0.0",
      "authority_path": "contracts/source-workload-v1.schema.json",
      "schema_pointer": "#",
      "owner": "workload-driver",
      "producers": ["workload-driver"],
      "consumers": ["source-adapter", "evidence-assembler"],
      "compatibility_class": "STRICT_MAJOR_ADDITIVE_MINOR",
      "required_fields": ["workload_id", "seed", "tables", "operation_mix", "fault_schedule", "expected_source_frontier", "expected_logical_state_digest"],
      "optional_fields": [],
      "conditional_fields": [],
      "unknown_field_policy": "REJECT",
      "canonicalization_profile": "changebridge-canonical-json/1.0.0",
      "identity_profile": "workload_id",
      "requirement_ids": ["CB-EVIDENCE-003"],
      "adr_ids": ["ADR-014"],
      "component_ids": ["evidence_manifest_store"],
      "invariant_ids": ["replay_determinism", "evidence_binding"],
      "claim_ids": ["CB-CLAIM-005"],
      "lifecycle": "ACTIVE",
      "replacement_id": null,
      "deprecation_stage": null,
      "local_validator": "jsonschema.Draft202012Validator",
      "future_managed_proof_owner": "part3-managed-proof"
    },
    {
      "id": "target_record_metadata",
      "title": "Target record lineage metadata",
      "version": "1.0.0",
      "schema_uri": "urn:changebridge:contract:target-record-metadata:1.0.0",
      "authority_path": "contracts/target-record-metadata-v1.schema.json",
      "schema_pointer": "#",
      "owner": "target-apply-adapter",
      "producers": ["target-apply-adapter"],
      "consumers": ["reconciliation-runner", "evidence-assembler"],
      "compatibility_class": "STRICT_MAJOR_ADDITIVE_MINOR",
      "required_fields": ["generation_id", "source_position", "transaction_id", "event_id", "operation", "source_schema_digest", "apply_attempt", "tombstone", "target_commit_id", "row_digest"],
      "optional_fields": [],
      "conditional_fields": [],
      "unknown_field_policy": "REJECT",
      "canonicalization_profile": "changebridge-canonical-json/1.0.0",
      "identity_profile": "generation_id+event_id",
      "requirement_ids": ["CB-ORDER-001", "CB-CHECKPOINT-001", "CB-SCHEMA-001"],
      "adr_ids": ["ADR-006", "ADR-007"],
      "component_ids": ["migration_apply_engine"],
      "invariant_ids": ["checkpoint_coupling", "delete_correctness", "evidence_binding"],
      "claim_ids": [],
      "lifecycle": "ACTIVE",
      "replacement_id": null,
      "deprecation_stage": null,
      "local_validator": "jsonschema.Draft202012Validator",
      "future_managed_proof_owner": "part2-runtime"
    },
    {
      "id": "orders_source_contract",
      "title": "Orders source contract",
      "version": "1.0.0",
      "schema_uri": "urn:changebridge:orders:v1",
      "authority_path": "contracts/orders-v1.json",
      "schema_pointer": "#",
      "owner": "schema-registry",
      "producers": ["source-adapter"],
      "consumers": ["schema-compatibility-gate", "cdc-normalizer"],
      "compatibility_class": "STRICT_MAJOR_ADDITIVE_MINOR",
      "required_fields": ["order_id", "customer_id", "amount"],
      "optional_fields": ["campaign_id"],
      "conditional_fields": [],
      "unknown_field_policy": "REJECT",
      "canonicalization_profile": "changebridge-canonical-json/1.0.0",
      "identity_profile": "contract_digest",
      "requirement_ids": ["CB-SCHEMA-001"],
      "adr_ids": ["ADR-008"],
      "component_ids": ["schema_coordinator"],
      "invariant_ids": ["schema_safety"],
      "claim_ids": [],
      "lifecycle": "ACTIVE",
      "replacement_id": null,
      "deprecation_stage": null,
      "local_validator": "jsonschema.Draft202012Validator",
      "future_managed_proof_owner": "part2-runtime"
    },
    {
      "id": "migration_generation",
      "title": "Migration generation",
      "version": "1.0.0",
      "schema_uri": "urn:changebridge:contract:migration-generation:1.0.0",
      "authority_path": "contracts/control/control-records-v1.schema.json",
      "schema_pointer": "#/$defs/migration_generation",
      "owner": "generation-controller",
      "producers": ["generation-controller"],
      "consumers": ["snapshot-reader", "cdc-capture", "proof-controller"],
      "compatibility_class": "STRICT_MAJOR_ADDITIVE_MINOR",
      "required_fields": ["generation_id", "snapshot_frontier", "schema_set_digest", "state"],
      "optional_fields": [],
      "conditional_fields": [],
      "unknown_field_policy": "REJECT",
      "canonicalization_profile": "changebridge-canonical-json/1.0.0",
      "identity_profile": "record_id",
      "requirement_ids": ["CB-BOUNDARY-001", "CB-ISOLATION-001"],
      "adr_ids": ["ADR-001", "ADR-002"],
      "component_ids": ["generation_registry"],
      "invariant_ids": ["boundary", "generation_isolation"],
      "claim_ids": [],
      "lifecycle": "ACTIVE",
      "replacement_id": null,
      "deprecation_stage": null,
      "local_validator": "scripts/validate_contract_oracle_authority.py",
      "future_managed_proof_owner": "part2-runtime"
    },
    {
      "id": "frontier_checkpoint",
      "title": "Frontier checkpoint",
      "version": "1.0.0",
      "schema_uri": "urn:changebridge:contract:frontier-checkpoint:1.0.0",
      "authority_path": "contracts/control/control-records-v1.schema.json",
      "schema_pointer": "#/$defs/frontier_checkpoint",
      "owner": "checkpoint-store",
      "producers": ["target-apply-adapter"],
      "consumers": ["generation-controller", "proof-controller"],
      "compatibility_class": "STRICT_MAJOR_ADDITIVE_MINOR",
      "required_fields": ["previous_frontier", "current_frontier", "target_commit_id", "target_commit_digest"],
      "optional_fields": [],
      "conditional_fields": [],
      "unknown_field_policy": "REJECT",
      "canonicalization_profile": "changebridge-canonical-json/1.0.0",
      "identity_profile": "record_id+revision",
      "requirement_ids": ["CB-CHECKPOINT-001"],
      "adr_ids": ["ADR-006"],
      "component_ids": ["checkpoint_ledger"],
      "invariant_ids": ["checkpoint_coupling", "failure_atomicity"],
      "claim_ids": [],
      "lifecycle": "ACTIVE",
      "replacement_id": null,
      "deprecation_stage": null,
      "local_validator": "scripts/validate_contract_oracle_authority.py",
      "future_managed_proof_owner": "part2-runtime"
    },
    {
      "id": "applied_transaction",
      "title": "Applied transaction receipt",
      "version": "1.0.0",
      "schema_uri": "urn:changebridge:contract:applied-transaction:1.0.0",
      "authority_path": "contracts/control/control-records-v1.schema.json",
      "schema_pointer": "#/$defs/applied_transaction",
      "owner": "target-apply-adapter",
      "producers": ["target-apply-adapter"],
      "consumers": ["checkpoint-store", "evidence-assembler"],
      "compatibility_class": "STRICT_MAJOR_ADDITIVE_MINOR",